<?xml version="1.0" encoding="UTF-8"?>
<drugAccountabilityRequest
    xmlns:xsi="http://www.w3.org/2001/XMLSchema-instance"
    xsi:schemaLocation="gov/va/med/pharmacy/peps/external/common/vo/inbound/drug/drugaccountability/request ../../../schema/drug/drugaccountability/DrugAccountabilityRequest.xsd "
    xmlns="gov/va/med/pharmacy/peps/external/common/vo/inbound/drug/drugaccountability/request">
    <requestAdd>
        <ndc>024322-3660-93</ndc>
        <vuid>4002698</vuid>
        <orderUnit>EA</orderUnit>
        <pricePerDispenseUnit>80.01</pricePerDispenseUnit>
        <pricePerOrderUnit>80.02</pricePerOrderUnit>
        <addSynonymFields>
            <vsn>VSN80</vsn>
            <vendor>McKesson Corporation</vendor>
            <dispenseUnitsPerOrderUnit>80.03</dispenseUnitsPerOrderUnit>
        </addSynonymFields>
        <addNDCFields>
            <vsn>VSN80</vsn>
            <vendor>McKesson Corporation</vendor>
            <dispenseUnitsPerOrderUnit>80.03</dispenseUnitsPerOrderUnit>
            <otcRXIndicator>0</otcRXIndicator>
            <manufacturer>EMD</manufacturer>
        </addNDCFields>
        <addProductFields>
            <dispenseUnitPerOrderUnit>80.03</dispenseUnitPerOrderUnit>
            <currentInventory>80</currentInventory>
            <ifcapItemNumber>80</ifcapItemNumber>
        </addProductFields>
    </requestAdd>
    
    <requestUpdate>
        <ndc>002669-9010-99</ndc>
        <vuid>4002698</vuid>
        <updateSynonymFields>
            <vsn>VSN81</vsn>
            <vendor>McKesson Corporation</vendor>
            <orderUnit>BT</orderUnit>
            <pricePerOrderUnit>81.02</pricePerOrderUnit>
            <dispenseUnitsPerOrderUnit>81.03</dispenseUnitsPerOrderUnit>
            <pricePerDispenseUnit>81.01</pricePerDispenseUnit>
        </updateSynonymFields>
        <updateNDCFields>
            <vsn>VSN81</vsn>
            <vendor>McKesson Corporation</vendor>
            <orderUnit>BT</orderUnit>
            <pricePerOrderUnit>81.02</pricePerOrderUnit>
            <dispenseUnitsPerOrderUnit>81.03</dispenseUnitsPerOrderUnit>
            <pricePerDispenseUnit>81.01</pricePerDispenseUnit>
            <otcRXIndicator>0</otcRXIndicator>
            <manufacturer>AMER RED CROSS</manufacturer>
        </updateNDCFields>
        <updateProductFields>
            <orderUnit>BT</orderUnit>
            <pricePerOrderUnit>81.02</pricePerOrderUnit>
            <dispenseUnitsPerOrderUnit>81.03</dispenseUnitsPerOrderUnit>
            <pricePerDispenseUnit>81.01</pricePerDispenseUnit>
            <currentInventory>81</currentInventory>
            <ifcapItemNumber>81</ifcapItemNumber>
        </updateProductFields>
    </requestUpdate>
</drugAccountabilityRequest>